{
  "contract": "DOR-LOCALIZATION-BATCH/0.5",
  "case_column": "case_id",
  "n_cases": 29,
  "status_counts": {
    "SUPPORTED": 29
  },
  "cases": [
    {
      "case_id": "HYD_0569",
      "result": {
        "contract": "DOR-LOCALIZATION-RESULT/0.5",
        "status": "SUPPORTED",
        "reason": "all retained fault groups are individually resolved; concurrent faults across groups are allowed",
        "fault_hypotheses": [
          {
            "fault_id": "accumulator_pressure_severely_reduced",
            "target_component_id": "accumulator",
            "fault_mode": "pressure_100_bar",
            "category": "PARAMETRIC",
            "score": 1.0,
            "explicit_support": 1.0,
            "scope_bonus": 0.0,
            "contradiction_fraction": 0.0,
            "matched_evidence": [
              "HYD_0569:accumulator:class"
            ],
            "contradicting_evidence": [],
            "missing_expected": [],
            "eligible": true,
            "exclusion_group": "accumulator_condition"
          }
        ],
        "all_scored_hypotheses": [
          {
            "fault_id": "accumulator_pressure_severely_reduced",
            "target_component_id": "accumulator",
            "fault_mode": "pressure_100_bar",
            "category": "PARAMETRIC",
            "score": 1.0,
            "explicit_support": 1.0,
            "scope_bonus": 0.0,
            "contradiction_fraction": 0.0,
            "matched_evidence": [
              "HYD_0569:accumulator:class"
            ],
            "contradicting_evidence": [],
            "missing_expected": [],
            "eligible": true,
            "exclusion_group": "accumulator_condition"
          },
          {
            "fault_id": "pump_internal_leakage_weak",
            "target_component_id": "pump",
            "fault_mode": "internal_leakage_weak",
            "category": "PARAMETRIC",
            "score": 0.0,
            "explicit_support": 0.0,
            "scope_bonus": 0.0,
            "contradiction_fraction": 1.0,
            "matched_evidence": [],
            "contradicting_evidence": [
              "HYD_0569:pump:class"
            ],
            "missing_expected": [],
            "eligible": false
          },
          {
            "fault_id": "pump_internal_leakage_severe",
            "target_component_id": "pump",
            "fault_mode": "internal_leakage_severe",
            "category": "PARAMETRIC",
            "score": 0.0,
            "explicit_support": 0.0,
            "scope_bonus": 0.0,
            "contradiction_fraction": 1.0,
            "matched_evidence": [],
            "contradicting_evidence": [
              "HYD_0569:pump:class"
            ],
            "missing_expected": [],
            "eligible": false
          },
          {
            "fault_id": "accumulator_pressure_slightly_reduced",
            "target_component_id": "accumulator",
            "fault_mode": "pressure_115_bar",
            "category": "PARAMETRIC",
            "score": 0.0,
            "explicit_support": 0.0,
            "scope_bonus": 0.0,
            "contradiction_fraction": 1.0,
            "matched_evidence": [],
            "contradicting_evidence": [
              "HYD_0569:accumulator:class"
            ],
            "missing_expected": [],
            "eligible": false
          },
          {
            "fault_id": "accumulator_pressure_close_to_total_failure",
            "target_component_id": "accumulator",
            "fault_mode": "pressure_90_bar",
            "category": "PARAMETRIC",
            "score": 0.0,
            "explicit_support": 0.0,
            "scope_bonus": 0.0,
            "contradiction_fraction": 1.0,
            "matched_evidence": [],
            "contradicting_evidence": [
              "HYD_0569:accumulator:class"
            ],
            "missing_expected": [],
            "eligible": false
          }
        ],
        "component_candidates": [
          {
            "component_id": "accumulator",
            "score": 1.0,
            "retained_fault_ids": [
              "accumulator_pressure_severely_reduced"
            ]
          }
        ],
        "supported_fault_set": [
          "accumulator_pressure_severely_reduced"
        ],
        "candidate_fault_sets": [
          [
            "accumulator_pressure_severely_reduced"
          ]
        ],
        "ambiguous_exclusion_groups": {},
        "evidence_summary": {
          "total": 2,
          "valid": 2,
          "invalid_or_unsupported": 0
        },
        "policy": {
          "min_support": 0.45,
          "retain_margin": 0.08,
          "max_contradiction_fraction": 0.35,
          "candidate_set_cap": 32
        },
        "safety": {
          "root_cause_claimed": false,
          "propagation_inferred": false,
          "invalid_evidence_used_for_scoring": false,
          "generic_component_or_mechanism_evidence_cannot_by_itself_identify_fault_mode": true,
          "concurrent_faults_are_not_relabelled_as_alternatives": true
        }
      }
    },
    {
      "case_id": "HYD_0572",
      "result": {
        "contract": "DOR-LOCALIZATION-RESULT/0.5",
        "status": "SUPPORTED",
        "reason": "all retained fault groups are individually resolved; concurrent faults across groups are allowed",
        "fault_hypotheses": [
          {
            "fault_id": "accumulator_pressure_severely_reduced",
            "target_component_id": "accumulator",
            "fault_mode": "pressure_100_bar",
            "category": "PARAMETRIC",
            "score": 1.0,
            "explicit_support": 1.0,
            "scope_bonus": 0.0,
            "contradiction_fraction": 0.0,
            "matched_evidence": [
              "HYD_0572:accumulator:class"
            ],
            "contradicting_evidence": [],
            "missing_expected": [],
            "eligible": true,
            "exclusion_group": "accumulator_condition"
          }
        ],
        "all_scored_hypotheses": [
          {
            "fault_id": "accumulator_pressure_severely_reduced",
            "target_component_id": "accumulator",
            "fault_mode": "pressure_100_bar",
            "category": "PARAMETRIC",
            "score": 1.0,
            "explicit_support": 1.0,
            "scope_bonus": 0.0,
            "contradiction_fraction": 0.0,
            "matched_evidence": [
              "HYD_0572:accumulator:class"
            ],
            "contradicting_evidence": [],
            "missing_expected": [],
            "eligible": true,
            "exclusion_group": "accumulator_condition"
          },
          {
            "fault_id": "pump_internal_leakage_weak",
            "target_component_id": "pump",
            "fault_mode": "internal_leakage_weak",
            "category": "PARAMETRIC",
            "score": 0.0,
            "explicit_support": 0.0,
            "scope_bonus": 0.0,
            "contradiction_fraction": 1.0,
            "matched_evidence": [],
            "contradicting_evidence": [
              "HYD_0572:pump:class"
            ],
            "missing_expected": [],
            "eligible": false
          },
          {
            "fault_id": "pump_internal_leakage_severe",
            "target_component_id": "pump",
            "fault_mode": "internal_leakage_severe",
            "category": "PARAMETRIC",
            "score": 0.0,
            "explicit_support": 0.0,
            "scope_bonus": 0.0,
            "contradiction_fraction": 1.0,
            "matched_evidence": [],
            "contradicting_evidence": [
              "HYD_0572:pump:class"
            ],
            "missing_expected": [],
            "eligible": false
          },
          {
            "fault_id": "accumulator_pressure_slightly_reduced",
            "target_component_id": "accumulator",
            "fault_mode": "pressure_115_bar",
            "category": "PARAMETRIC",
            "score": 0.0,
            "explicit_support": 0.0,
            "scope_bonus": 0.0,
            "contradiction_fraction": 1.0,
            "matched_evidence": [],
            "contradicting_evidence": [
              "HYD_0572:accumulator:class"
            ],
            "missing_expected": [],
            "eligible": false
          },
          {
            "fault_id": "accumulator_pressure_close_to_total_failure",
            "target_component_id": "accumulator",
            "fault_mode": "pressure_90_bar",
            "category": "PARAMETRIC",
            "score": 0.0,
            "explicit_support": 0.0,
            "scope_bonus": 0.0,
            "contradiction_fraction": 1.0,
            "matched_evidence": [],
            "contradicting_evidence": [
              "HYD_0572:accumulator:class"
            ],
            "missing_expected": [],
            "eligible": false
          }
        ],
        "component_candidates": [
          {
            "component_id": "accumulator",
            "score": 1.0,
            "retained_fault_ids": [
              "accumulator_pressure_severely_reduced"
            ]
          }
        ],
        "supported_fault_set": [
          "accumulator_pressure_severely_reduced"
        ],
        "candidate_fault_sets": [
          [
            "accumulator_pressure_severely_reduced"
          ]
        ],
        "ambiguous_exclusion_groups": {},
        "evidence_summary": {
          "total": 2,
          "valid": 2,
          "invalid_or_unsupported": 0
        },
        "policy": {
          "min_support": 0.45,
          "retain_margin": 0.08,
          "max_contradiction_fraction": 0.35,
          "candidate_set_cap": 32
        },
        "safety": {
          "root_cause_claimed": false,
          "propagation_inferred": false,
          "invalid_evidence_used_for_scoring": false,
          "generic_component_or_mechanism_evidence_cannot_by_itself_identify_fault_mode": true,
          "concurrent_faults_are_not_relabelled_as_alternatives": true
        }